{
  "agent_id": "Agent-8",
  "agent_name": "SSOT & System Integration Specialist",
  "status": "ACTIVE_AGENT_MODE",
  "current_phase": "TASK_EXECUTION",
  "last_updated": "2025-01-27T12:00:00.000000Z",
  "current_mission": "V2 Tools Flattening + Toolbelt Audit",
  "mission_priority": "HIGH",
  "current_tasks": [
    "V2 Tools Flattening: Phase 4 SSOT Verification Complete",
    "SSOT Violations: Consolidate duplicate tool implementations",
    "Lead consolidation of leaderboard, ROI, and points calculators",
    "Coordinate with Agent-2 and Agent-6 on consolidation strategy"
  ],
  "completed_tasks": [
    "Completed comprehensive audit of tools_v2/ structure",
    "Identified 17 captain tools in tools/ needing migration",
    "Analyzed adapter pattern compliance (124+ tools verified)",
    "Created detailed audit report with migration roadmap",
    "Fixed captain_coordination_tools.py to use IToolAdapter pattern (4 tools)",
    "Migrated high-priority captain tools (3 tools)",
    "Registered 7 new tools in tool_registry.py",
    "Created coordination messages for Agent-1 and Agent-7",
    "Sent progress report to Agent-4",
    "Phase 4 SSOT Verification Complete - 3 violations identified",
    "Created SSOT verification report with consolidation recommendations"
  ],
  "achievements": [
    "V2 Tools Flattening Audit Complete",
    "SSOT Violations Fixed (captain_coordination_tools.py)",
    "7 Captain Tools Migrated",
    "Consolidation Roadmap Created",
    "Phase 1 Complete",
    "Phase 4 SSOT Verification Complete",
    "3 SSOT Violations Documented with Consolidation Plan"
  ],
  "next_actions": [
    "Consolidate duplicate leaderboard tools (HIGH PRIORITY)",
    "Review and consolidate ROI calculator tools",
    "Review and consolidate points calculator tools",
    "Coordinate with Agent-2 on consolidation strategy",
    "Update coordination plan with SSOT resolution"
  ]
}