{
  "agent_id": "Agent-5",
  "agent_name": "Business Intelligence Specialist",
  "status": "ACTIVE_AGENT_MODE",
  "current_phase": "TASK_EXECUTION",
  "last_updated": "2025-01-27T12:30:00.000000Z",
  "current_mission": "V2 Tools Flattening - BI Tools Migration",
  "mission_priority": "HIGH",
  "current_tasks": [
    "V2 Tools Flattening: BI tools migration complete ✅",
    "BI monitoring: Trading Consolidation Phase 2 tracking active",
    "Monetization Week 1: Service packaging plan created",
    "Missing BI tools: Clarification needed (metrics_aggregator.py, task_roi_analyzer.py)",
    "V2 violations scan: Completed, violations identified",
    "Support Agent-1: Ready for GH-015-002 validation"
  ],
  "completed_tasks": [
    "V2 Tools Flattening: Created bi_tools.py category (4 tools migrated)",
    "Tool registry updated with 4 BI tool adapters",
    "Categories export updated",
    "Complexity analyzer refactoring (619→38 lines, modular)",
    "BI analytics files verified V2 compliant"
  ],
  "achievements": [
    "4 BI tools migrated to tools_v2 following adapter pattern",
    "V2 compliance maintained (280 lines, <400 limit)",
    "Zero linter errors",
    "Tool registry integration complete"
  ],
  "next_actions": [
    "Test BI tools via toolbelt CLI",
    "Coordinate with other agents on V2 flattening progress",
    "Continue BI monitoring and test suite creation",
    "Support Agent-1 GH-015-002 validation if needed"
  ]
}