{
  "agent_id": "Agent-4",
  "agent_name": "Captain (Strategic Oversight)",
  "status": "ACTIVE_AGENT_MODE",
  "current_phase": "TASK_EXECUTION",
  "last_updated": "2025-01-27T12:30:00.000000Z",
  "current_mission": "V2 Compliance & Organization Phase",
  "mission_priority": "HIGH",
  "current_tasks": [
    "Monitoring Agent-3 Discord bot startup progress",
    "Coordinating V2 tools flattening across all agents",
    "Following up on toolbelt audit assignments",
    "Created V2 Tools Flattening action plan"
  ],
  "completed_tasks": [
    "Fixed incomplete emergency instructions file",
    "Created critical task assignment document",
    "Refactored urgent message handling - moved ctrl+enter to stalled flag",
    "Updated messaging system to add 'URGENT MESSAGE' prefix for urgent messages",
    "Sent task assignments to all relevant agents",
    "Broadcast V2 tools flattening message to all 8 agents",
    "Created task coordination status document",
    "Reviewed Agent-3's Discord bot assessment"
  ],
  "achievements": [
    "Documented final push procedures for secret removal",
    "Assigned critical tasks to Agent-3 (Discord bot startup)",
    "Assigned high-priority tasks to multiple agents",
    "Improved messaging system UX - urgent messages now work like normal with visual indicator"
  ],
  "next_actions": [
    "Monitor agent progress on assigned tasks",
    "Review Discord bot startup issues with Agent-3",
    "Coordinate V2 tools flattening effort"
  ]
}