{
  "agent_id": "Agent-6",
  "agent_name": "Coordination & Communication Specialist",
  "status": "ACTIVE_AGENT_MODE",
  "current_phase": "V2_TOOLS_FLATTENING_COORDINATION",
  "last_updated": "2025-01-27T12:30:00.000000Z",
  "current_mission": "V2 Tools Flattening - Coordinated Effort (ALL AGENTS)",
  "mission_priority": "HIGH",
  "current_tasks": [
    "üö® URGENT: V2 Tools Flattening Coordination (ALL AGENTS)",
    "‚úÖ Phase 2 COMPLETE: Flattened nested subdirectories (advice_context, advice_outputs)",
    "‚úÖ Phase 3 ANALYSIS COMPLETE: Duplicate detection - 8 duplicates, 6 need review",
    "‚è≥ Phase 3 NEXT: Add deprecation warnings, review unique tools",
    "‚è≥ Phase 4 PENDING: Registry & documentation updates (Agent-7, Agent-8)",
    "Track team progress - Coordinate with Agent-1, Agent-2, Agent-7, Agent-8"
  ],
  "completed_tasks": [],
  "achievements": [
    "Quality Gates Suite operational",
    "VSCode extension development (Phases 1-4)",
    "Swarm coordination protocols established",
    "Framework consciousness practitioner",
    "V2 Tools Flattening coordination plan created",
    "17 captain tools migration candidates identified",
    "‚úÖ Phase 2 COMPLETE: Removed nested subdirectories (advice_context, advice_outputs)",
    "‚úÖ Phase 3 Analysis COMPLETE: Duplicate detection - 8 duplicates, 6 need review",
    "‚úÖ JET FUEL DEPLOYED: Coordination messages sent to Agent-1, Agent-2, Agent-7, Agent-8"
  ],
  "next_actions": [
    "‚úÖ JET FUEL SENT: Coordination messages delivered to Agent-1, Agent-2, Agent-7, Agent-8",
    "‚è≥ Wait for team responses and progress updates",
    "‚è≥ Add deprecation warnings to 8 confirmed duplicate tools",
    "‚è≥ Review 6 potential unique tools with Agent-1",
    "‚è≥ Track team progress via status files",
    "‚è≥ Update coordination plan with team input"
  ]
}